user id ,question id,answer
19,1,"Passion, connection, emotion,"
19,2,No just awareness of body and movement.
19,3,Non verbal conversation.
19,4,In any type of dance it is important to have both.
19,5,Yes because it is all part and parcel of the communication to one another and the music.
19,6,Imperative.
19,7,I create an awareness of opposition.
19,8,Very
19,9,"That you are both aware of the distance, space, and volume of the partnership."
19,10,Making sure that you and your partner are always on balance by not pushing or pulling.
20,1,"Depends on the partner, style of dance and difficulty, whether it is a new partner, woman or man, whether we are in rehearsal or in performance.   But in a performance where all is rehearsed I concentrate on dancing and expressing the meaning/feeling/expression of the choreography in unison with my partner."
20,2,"Relax, listen to body language."
20,3,Listen to each other and feel each other‚Äôs limits which will make us able to explore new material together
20,4,My style of dance is modern. Physical and visual contact in partnering is necessary in any style of dance.
20,5,"Yes, we have to be able to dance together. Without a common rhythm we won‚Äôt."
20,6,"Depends on choreography, but yes, when leaning, lifting, holding, and finding new ways to do so it is necessary to touch. But not all partnering work have to include touch, depends on what the choreographer wants"
20,7,"That depends on the choreography, expression or what you want to convey. Physically, both parts need to know how we relate to each other to be able to dance together.  "
20,8,"Again, it depends on the choreography, the visual contact need to relate to the kind of relationship we have or have to express. It is not always a romantic one in modern dance. We can communicate both visually and through our bodies, and if we know each other well we do not always have to look at each other to know where we are or what to do, we can feel it. "
20,9,"I have not heard that term before, but knowing where to be in relation to each other to create a common expression"
20,10,Rehearsal and contact improvisation will improve how we move  and relate to each other. 
20,11,"Your questions seem to be related to your ballroom style. In modern dance we use each other all the time, partnering often with more than one, men and women. We use each other by lifting, leaning, being under, over, dragging, falling, catching etc and need to relate to each other as partners, and often to more than one person at the same time. If I have a romantic partnering choreography I need to communicate that to the audience, but if I have a plain leaning and lifting task for the sake of movement I need to express just that.   My feeling towards the partner will change as I change partners all the time and have different moods or feelings I need to express depending on the choreography.  As for the relationship between me and my partner we need to be comfortable with each other to make it work and worth watching. "
21,1,"Depends on the relationship, if it‚Äôs a good one quite conformable, it depends on the chemistry, if there is mutual like it can feel nice."
21,2,Touch communication
21,3,"Chemistry, confidence"
21,4, Not sure what this question means
21,5,Its part of the movement in dance when solo so it will impact on partner work
21,6,Why else would you need a partner
21,7,Can discuss before hand or signal to your partner
21,8,You need to listen to and watch each other to sense the movements
21,9,A joining of your centres
21,10,"Contact improvisation, one leading one following with eyes closes"
22,1,"Excitement, nice to be able to trust and be trusted, inspire through movement and be inspired. A dialogue through movement. Shared time and space in order to move together in a certain, agreed way."
22,2,"Touch, gaze, controlling the weight and positions as precisely as possible."
22,3,"Trust, shared vocabulary and goals in movement, style and technique."
22,4,Both are powerful tools to create a strong and powerful connection between the movers. A connection also visible to the watcher.
22,5,"Both very important for timing and shared moments of effort for movement efficiency (like in turns, big traveling steps and lifts)"
22,6,"Yes, it creates connectivity between partners, shows trust and respect towards each other, can give movement that certain sth."
22,7,"Weight can be used apart from each other and supported by each other, together with a shared center, depends on the technique and the style of dance"
22,8,In looking at each other we agree to move together. Important also for cueing in big lifts e.g.
22,9,Two or more bodies can share the same center in order to create movement. It is the center of that certain movement and not of gravity
22,10,"Sharing experiences of movement and moving together in conversations, trying moves in different ways to find the one ‚Äúthat works for us‚Äù. Having an outside eye to see ‚Äúif what we feel and what we are trying to show‚Äù can be seen. Practice alone AND together or change positions (the one that carried, will be carried e.g.)."
22,11,"The conenection between partners is essential as it can blow of everything a dancer has learned. If the connection is not there, none of the two can perform at his/her  highest ability. Concentrating on what I do or the partner does differently in repetitions can bring valuable results when used as new input. The touch we use in dance should be suitable for what it is used for or what it should represent."
23,1,
23,2,"Personally, I find they need to be slowly ëunpackedí, people must first release tension and then try to be dynamic, body time is needed for this processÖa communication must happen between the students and the teacher. The students must be able to retain the information and reproduce it when the teacher is not there. It is more than just learning how to be a ëgood tableí. Also, to be able to improvise requires an understanding of certain body awareness rather than only choreography. As the martial arts take stages of development, the same I use in contact, information consumption is not necessarily its embodiment."
23,3,
23,4,"As the origins of contact are from various disciplines; Steve Paxton was influenced by yoga, aikido, was a gymnast and a modern dancer, it is inherently related to them. Also on a political and social levels Contact was about democratizing dance and allowing for other sources to influences to come in such as those from various eastern practices and philosophies. The concepts of circularity, energy, dyads and social dance are all outcomes of that and are a part of contact.Learning how to use your weight, experiencing the center between two bodies would help understand the center in any form. In ballroom it can probably be used to help the couple work together through the center, even though there is a leader/follower element involved, it can benefit from lets say eyes closed training to improve the sensitive from both sides."
23,5,
23,6,"Waking up the body, being aware, applied to dance it can help recognize different aspects of contact (blue vs green vs red) sensitizing the body for contact. Sensing the difference between a light touch or giving weight, it seems obvious but is not always so, especially for beginners. Being able to recognize, to feel it in yourself and then play with it together with another body."
23,7,"A common misconception is about strength being needed while forgetting the natural utility of the body as a tool. We understand this generally as we pick up and carry things around but donít always know how to deal with this in terms of another body. It is not only about understanding the mechanics of the body but a social issue as well, to open all your skin surfaces to an unfamiliar body is a weird conceptÖwe need to let go of some things to do that but often we donít even know what it is it we need to let go offÖengaging with a pelvis is another principle that is common and even if understood can still be awkward for various reasonsÖ"
23,8,"In Contact Improv. eyes closed training often brings more sensitivity and helps reduce social anxiety related to touch etcÖAfter a time visual contact can be brought in to increase use of surrounding space, safety, and can be used as another method of communicating. (another open palette)"
23,9,
23,10,"Jamming in contact provides a community ground, a social context where people can communicate. The people who come there usually have some interest in opening themselves to new experiences and communicating. This is not about the exercise then but has a rippling effect where it promotes the same principles.Contact can also be taught with so many awareness exercises but more as a physical form, it depends on the teachers and simply has a different emphasis. One is not necessarily better than the other, just different paths. Perhaps one can lead to the other, inner awareness to physical manifestation and physical manifestation to inner awareness."
23,11,"In Contact Improv. there is a political element as well as it was never patented and meant to be shared by everyone, so everyone could use it in different ways to enhance their practices. Ballet on the other hand is different in form and politics so perhaps could not be used in the same wayÖ"
24,2,
24,3,some of the elastic stretching elements are used in contact to create more surfaces on the body for your partner while the spiraling helps create momentum and fit the bodies into each other during various sequences of movement (turning shoulder lift for example)
24,4,
24,5,Yes breath can be used to help timing and rhythm. You can try to practice the counterbalancing exercises using breath which should help the common rhythm and improve the sensitivity of the partnering balance. Also just proximity (e.g. hugging) can help partners get used to being and moving close and togetherÖ
24,6,
24,7,"In contact moves are developed by improvisation and exploration, teaching is one of the few impetuses for systematization. Use of weight and momentum are essential. For beginners the rolling and other floor exercises facilitate understanding of weight and movement. There are no really systematic steps to teaching and different teachers prioritize different elements."
24,8,
24,9,
24,11,"contact can help ballroom dancers be more economical and efficient in their movements perhaps as well as exploring more surfaces on the body, these principles can be adjusted from contact to the ballroom aesthetic to fit the form."
25,1,
25,2,
25,3,"Timing and music are also very important, without music, a natural rhythm that can develop between partners. All these elements are important for a good partnership"
25,4,"As far as other styles go, in contemporary there are a lot of elements that are similar to contemporary tango so as much attention is put into the awareness of touch, weight sharing, and visual contact as in tango. It is a question of stage or social context, ballet is mostly danced on stage with an outward focus while tango as a social dance is danced for yourself and that is an important differenceÖcompetitive ballroom and social ballroom also show a similar contrast. Since in tango both performance and social aspects exist people have a choice, if you want to dance socially and improvise it is one focus, while if you want to perform and work on choreography it is another. Everyone should find their own tangoÖ"
25,5,
25,6,Well touch is similar to weight sharing for me; the more experienced you are the more you can explore the possibilities and limits of weight sharing and touch
25,7,
25,8,"Visual contact is more about meaning, this brings me to another element that is spiritual, I canít dance with just anyone, there has to be a deeper connection and understanding"
25,9,
25,10,"Perhaps some games can be used to improve touch, weight sharing, and visual contact. Like some contact improvisation exercises, imagery, and rolling around the floor on top of each other are games for meÖ"
25,11,"I think one can get involved in other movement disciplines which can help in various ways, Tai chi for example can help with coordination and slowness in movement while contact improvisation can help explore different body surfaces. In tango there is only one main surface used (the embrace in the upper body, chest and sometimes head area depending on style) that is hard enough already to explore so discovering other surfaces can certainly be beneficial and might help the dancer be more aware of the sensations of touch etcÖ"
26,2,"It dependsÖwhen dancers already have a strong vocabulary they might not need to train specifically for partnering since they already ëspeak the same languageí. Otherwise the material might appear awkwardÖas is sometimes the case, so perhaps with lower level dancers those might be more importantÖWhen I met another experienced contact improviser it sometimes just clicks and things work naturally without specific trainingÖThe reason in contact we do these exercises is simply to get back to basics and keep training our awareness"
26,3,"There are political and social element always at play, what used to be is not the case now, dance expresses its timesÖalso touch today is usually considered sexual or violent and dance is one of the only places where people can communicate and connect physically without those social taboosÖit is also a community, just like the social ballroom instead of competitive, there are no winners or losersÖ"
26,4,"In ballet the choreography is for stage, the man is there to display the woman, in an old fashioned way. Now the world is different, a man might be supported by a woman and even a woman might be bigger than the manÖIt is political after all, contact was developed in a time of cultural change, feminism, and free love, and that is the values it reflectsÖIn a way the leading and following in ballroom is also a political statement."
26,5,
26,6,
26,7,
26,8,
26,9,
26,10,"Since contact is not driven by form but y the shape of the body and the its sensations certain aesthetical elements needed for ballroom are not necessarily present there, the question of aesthetics on top of that is an open one so with the leaning back and holding hands exercise for example in contact weíd let the back curve simply because it can do that and there is no need for us to stop it, it is aesthetic or rather natural for contact due to its philosophy and approach to the body. The improvisation aspect of Contact keeps it open and evolving but otherwise the ends of these exercises are similar in both styles. Even in contact a vocabulary eventually evolves even though it tries to break away from itÖ"
26,11,"Some dancers/choreographersí already combine ballet and contact, (Raphael Malison?) they learn the effects of gravity and weight on the body and interpret it through their knowledge. It is not really classical anymore, but rather a blend of ballet and martial arts and other influences."
27,2,"Sometimes personality comes into play in a partnership too, if a man is a narcissist he will never partner in same way as someone who is caring to his partner. The quality therefore is different in such a partnership because while most of the technical elements can be there, a lack of interest can affect the presence of certain performance qualities in a partnership."
27,3,"In classical ballet, it is common to use gestures to present the lady, inviting, calling or even rejecting in various forms. There is no improvisation so everything is choreographed and both dancers know what they need to do. Many theatrical elements come into play, the style of connecting might change from role to role (romantic, evil, pitiful, etcÖ) the posture and the style of movement might change with the character played (e.g. Spartacus vs Quasi modo)"
27,4,
27,5,
27,6,
27,7,
27,8,
27,9,
27,10,"Not really, we mostly practice partnering with choreography. A progressive approach from small jumps and supports to big lifts allows for improvement. In reality there is simply not much extra time in the 8 year curriculum to train extra element while there is so much work to be done to prepare the student for a professional career in ballet."
27,11,"It would be as useful as any other exercise to improve certain elements, it would of course be nice to be able to be work on these sensitivities but as they are not a priority for most ballet dancers, there is probably no time for them. On top of that using counterbalance often puts the dancer off the center line and that is a rare happening in classical ballet, in modern more perhaps but in classical such usage of connection would mainly be useful in waltzes and small jumps with a lift for the lady so perhaps it is simply a question of time and priorities."
